{
    "$schema": "https://raw.githubusercontent.com/hakasapl/xpmf/main/schema/profile.schema.json",
    "name": "ash",
    "editorIds": [
        "AshMaterial*",
        "DLC2AshMaterial*",
        "AshLODMaterial*"
    ],
    "excludeEditorIds": [],
    "pbr": true,
    "diffuseTexture": "textures/pbr/dlc02/landscape/volcanic_ash_01.dds",
    "normalTexture": "textures/pbr/dlc02/landscape/volcanic_ash_01_n.dds",
    "lodMaterial": "AshLODMaterialMtns1P",
    "lodMaterialHD": "AshMaterialSolstheimMtns1P",
    "neutralizeVertexColors": true,
    "neutralizeVertexAlpha": true,
    "roofShelter": true,
    "shelterFade": 64
}