{
    "$schema": "https://raw.githubusercontent.com/hakasapl/xpmf/main/schema/profile.schema.json",
    "name": "snow",
    "editorIds": [
        "*snow*"
    ],
    "excludeEditorIds": [],
    "pbr": false,
    "diffuseTexture": "textures/landscape/snow01.dds",
    "normalTexture": "textures/landscape/snow01_n.dds",
    "lodMaterial": "SnowLODMaterial",
    "lodMaterialHD": "SnowLODMaterialHD",
    "neutralizeVertexColors": true,
    "neutralizeVertexAlpha": true,
    "neutralizeVertexAlphaSkip": [
        "*Walkway*Snow",
        "Farmhouse0?Snow",
        "FarmhouseSmith01Snow",
        "FarmInn01Snow",
        "BDS_FarmInnDestroyed01Snow",
        "BDS_FarmLumbermill01Snow"
    ],
    "roofShelter": true,
    "shelterFade": 64,
    "specularMult": 0
}